[
  {
    "version": "paired-registry/1.0",
    "sample_id": "flynn-aldol-055",
    "source": {
      "source_url": "https://www.flynnresearchgroup.com/s/Problem-Set-6-Aldol-answers.docx",
      "citation": "Flynn Research Group. Organic Chemistry Assessments, CHM 2120, Problem Set 6: Aldol (answers). n.d. Accessed 13 September 2026.",
      "author_or_project": "Flynn Research Group",
      "retrieved_at": "2026-09-13T10:30:04.438664+00:00",
      "original_sha256": "de90d98615712b2ee69d9fb060955076cab92a1dacce255ac25a7638d66650f6",
      "asset_types": [
        "CDX",
        "EMF",
        "PNG",
        "DOCX"
      ],
      "redistributable": "unknown",
      "license": null,
      "license_evidence_url": "https://www.flynnresearchgroup.com/organic-assessments",
      "container": {
        "sha256": "3b63557df14651b3ddaf7f4756e29ec6c43a75c3e9870218da257f961b7eb0cd",
        "member": "word/embeddings/oleObject55.bin",
        "stream": "CONTENTS"
      }
    },
    "mechanism_family": "proton_transfer; SN2; carbonyl",
    "complexity_profile": {
      "molecule_count": null,
      "caption_count": null,
      "simultaneous_flow_count": null,
      "common_scaffold_count": null,
      "dense_anchor_risk": null,
      "curved_arrow_count": 6,
      "lone_pair_count": 2,
      "charge_count": 1,
      "radical_count": null,
      "state_count": 3,
      "step_count": 2,
      "multirow": false,
      "snake_layout": false,
      "curved_arrow_candidate_count": 6
    },
    "curved_arrow_count": 6,
    "lone_pair_count": 2,
    "charge_count": 1,
    "state_count": 3,
    "step_count": 2,
    "condition_text_present": true,
    "structured_target_available": true,
    "native_render_available": true,
    "research_status": "native_paired",
    "redistributable": "unknown",
    "split": "research_development",
    "frozen_or_descendant": false,
    "lineage": [
      "external-author-acquisition/2026-09-13"
    ],
    "exposure_history": [
      {
        "timestamp": "2026-09-13T10:43:30.793472+00:00",
        "actor_role": "custodian",
        "asset_sha256": [
          "de90d98615712b2ee69d9fb060955076cab92a1dacce255ac25a7638d66650f6"
        ],
        "purpose": "source extraction and author-preview screening; separate from generator"
      },
      {
        "timestamp": "2026-09-13T10:42:37.4164793Z",
        "actor_role": "custodian",
        "asset_sha256": [
          "de90d98615712b2ee69d9fb060955076cab92a1dacce255ac25a7638d66650f6",
          "3b63557df14651b3ddaf7f4756e29ec6c43a75c3e9870218da257f961b7eb0cd",
          "780a49c8de9cda5dcd019f90af2a3457667a3a7e8f64b5d39681f93bc8851a0b",
          "bda51fbeec5a8348466de19c71d402cb0a207b8aca941547b2d1691e81ec13ce",
          "2aec591006d2e8e85e0e358ffdafdb0a1426dd9db8297258d0e06da2a79a6b6c",
          "9c501f09c5ca98389cb970038dab84306356667ca43197894cbaa097075ebf27",
          "00fce43a126bd665c2c744a4f87e80c42292127068ab3fc39a51fc75f8816918",
          "b607686c4c291138f85c38f5d99becc318a6c3725386a2d0c334ac825a8bffc6",
          "58edc246a052afdd106a70f6a0258eb10762bf54f5c6f2c7f21fa8f3aa9cdf20",
          "05d315e5459c37132d25aaf6af77717924d23d2ce460a9e3260478957811f6b2"
        ],
        "purpose": "native render/save/reopen and evaluator inventory; no generator context"
      },
      {
        "timestamp": "2026-09-13T11:08:56.920871+00:00",
        "actor_role": "evaluator",
        "asset_sha256": [
          "72ea565bc8eb4061987c6c6428b782873cb9fb36793ef680b513f0ee2dd59166",
          "d861b2a4d071fe06013e69827b8a190e6d84e4bd24a0f2d3cf9af32a819e5467",
          "c84ead0751e07bdedc681fd1364238a50c77df78532a5d56335e6de3268002f9",
          "4ba682d0247eafedff248957e4489927b63e8d564303edbd82d77327a33dcd6b"
        ],
        "purpose": "Independent fresh-process disk reads; separate from already completed generator input sealing."
      }
    ],
    "assets": [
      {
        "role": "original_target",
        "relative_locator": "source-survey-academic/extracted/flynn-org2-ps6-aldol-answers/oleObject55.cdx",
        "sha256": "de90d98615712b2ee69d9fb060955076cab92a1dacce255ac25a7638d66650f6",
        "bytes": 5690,
        "media_type": "chemical/x-cdx"
      },
      {
        "role": "source_container",
        "relative_locator": "source-survey-academic/flynn-org2-ps6-aldol-answers.docx",
        "sha256": "3b63557df14651b3ddaf7f4756e29ec6c43a75c3e9870218da257f961b7eb0cd",
        "bytes": 4549496,
        "media_type": "application/octet-stream"
      },
      {
        "role": "author_vector_preview",
        "relative_locator": "source-survey-academic/extracted/flynn-org2-ps6-aldol-answers/oleObject55.emf",
        "sha256": "780a49c8de9cda5dcd019f90af2a3457667a3a7e8f64b5d39681f93bc8851a0b",
        "bytes": 29200,
        "media_type": "image/emf"
      },
      {
        "role": "native_cdxml",
        "relative_locator": "native-target-55-attempt1/native.cdxml",
        "sha256": "bda51fbeec5a8348466de19c71d402cb0a207b8aca941547b2d1691e81ec13ce",
        "bytes": 16167,
        "media_type": "text/xml"
      },
      {
        "role": "native_cdx",
        "relative_locator": "native-target-55-attempt1/native.cdx",
        "sha256": "2aec591006d2e8e85e0e358ffdafdb0a1426dd9db8297258d0e06da2a79a6b6c",
        "bytes": 7216,
        "media_type": "chemical/x-cdx"
      },
      {
        "role": "native_reference_png",
        "relative_locator": "native-target-55-attempt1/native.png",
        "sha256": "9c501f09c5ca98389cb970038dab84306356667ca43197894cbaa097075ebf27",
        "bytes": 85697,
        "media_type": "image/png"
      },
      {
        "role": "native_viewing_jpeg",
        "relative_locator": "native-target-55-attempt1/native.jpeg",
        "sha256": "00fce43a126bd665c2c744a4f87e80c42292127068ab3fc39a51fc75f8816918",
        "bytes": 24562,
        "media_type": "image/jpeg"
      },
      {
        "role": "historical_same_process_cdx_reopen_readback",
        "relative_locator": "native-target-55-attempt1/cdx-readback.cdxml",
        "sha256": "b607686c4c291138f85c38f5d99becc318a6c3725386a2d0c334ac825a8bffc6",
        "bytes": 16173,
        "media_type": "text/xml"
      },
      {
        "role": "historical_same_process_cdxml_reopen_readback",
        "relative_locator": "native-target-55-attempt1/cdxml-readback.cdxml",
        "sha256": "58edc246a052afdd106a70f6a0258eb10762bf54f5c6f2c7f21fa8f3aa9cdf20",
        "bytes": 16446,
        "media_type": "text/xml"
      },
      {
        "role": "native_receipt",
        "relative_locator": "native-target-55-attempt1/events.jsonl",
        "sha256": "05d315e5459c37132d25aaf6af77717924d23d2ce460a9e3260478957811f6b2",
        "bytes": 38262,
        "media_type": "application/x-ndjson"
      },
      {
        "role": "cdx_fresh_process_readback",
        "relative_locator": "native-fresh-readbacks/flynn-aldol-055-cdx/readback.cdxml",
        "sha256": "72ea565bc8eb4061987c6c6428b782873cb9fb36793ef680b513f0ee2dd59166",
        "bytes": 16437,
        "media_type": "text/xml"
      },
      {
        "role": "cdx_fresh_process_receipt",
        "relative_locator": "native-fresh-readbacks/flynn-aldol-055-cdx/events.jsonl",
        "sha256": "d861b2a4d071fe06013e69827b8a190e6d84e4bd24a0f2d3cf9af32a819e5467",
        "bytes": 14153,
        "media_type": "application/x-ndjson"
      },
      {
        "role": "cdxml_fresh_process_readback",
        "relative_locator": "native-fresh-readbacks/flynn-aldol-055-cdxml/readback.cdxml",
        "sha256": "c84ead0751e07bdedc681fd1364238a50c77df78532a5d56335e6de3268002f9",
        "bytes": 16440,
        "media_type": "text/xml"
      },
      {
        "role": "cdxml_fresh_process_receipt",
        "relative_locator": "native-fresh-readbacks/flynn-aldol-055-cdxml/events.jsonl",
        "sha256": "4ba682d0247eafedff248957e4489927b63e8d564303edbd82d77327a33dcd6b",
        "bytes": 14215,
        "media_type": "application/x-ndjson"
      }
    ],
    "evidence_notes": [
      "Curved electron arrows and broad layout screened in author EMF rendered through Windows GDI. LP count is explicit symbol-object count; charge count is explicit nonzero atom-charge property count. Neither includes implicit chemistry or all text glyphs. Fragment/node/text inventories are raw native object counts, not segmented molecules/states/captions.",
      "Primary native pilot target selected by root; ester OMe and tert-butoxide abbreviations require semantic handling.",
      "Original-source and native-import counts may differ after abbreviation expansion. Native candidate arrow count is not a certified semantic binding.",
      "All source screening is AI-assisted development exposure; gold remains zero.",
      "Historical same-process readbacks preserve original hashes but do not prove disk reopening. Fresh per-format zero-document PID/HWND events and readbacks below supersede that claim; see verification/2026-09-13-paired-pilot/native-survey-checks.json. Native pairing does not imply lossless fidelity, editability, visual quality or human acceptance."
    ]
  },
  {
    "version": "paired-registry/1.0",
    "sample_id": "flynn-aldol-032",
    "source": {
      "source_url": "https://www.flynnresearchgroup.com/s/Problem-Set-6-Aldol-answers.docx",
      "citation": "Flynn Research Group. Organic Chemistry Assessments, CHM 2120, Problem Set 6: Aldol (answers). n.d. Accessed 13 September 2026.",
      "author_or_project": "Flynn Research Group",
      "retrieved_at": "2026-09-13T10:30:04.438664+00:00",
      "original_sha256": "1ea45a87ece50bfdf606d11c2666a07ed46029994bdb6379243cb4bc01e6baa3",
      "asset_types": [
        "CDX",
        "EMF",
        "PNG",
        "DOCX"
      ],
      "redistributable": "unknown",
      "license": null,
      "license_evidence_url": "https://www.flynnresearchgroup.com/organic-assessments",
      "container": {
        "sha256": "3b63557df14651b3ddaf7f4756e29ec6c43a75c3e9870218da257f961b7eb0cd",